{
  "$schema": "https://json-schema.org/draft/2020-12/schema",
  "title": "Vibe-Harness 评估套件",
  "type": "object",
  "required": ["schemaVersion", "id", "version", "description", "defaultRepetitions", "cases"],
  "properties": {
    "schemaVersion": { "type": "integer", "enum": [1] },
    "id": { "type": "string", "minLength": 1 },
    "version": { "type": "string", "minLength": 1 },
    "description": { "type": "string", "minLength": 1 },
    "defaultRepetitions": { "type": "integer", "minimum": 1, "maximum": 3 },
    "cases": {
      "type": "array",
      "minItems": 1,
      "items": {
        "type": "object",
        "required": ["id", "category", "capability", "risk", "input", "oracle", "weights", "repetitions"],
        "properties": {
          "id": { "type": "string", "minLength": 1 },
          "category": { "type": "string", "enum": ["install-lifecycle", "task-delivery-governance", "skill-routing", "safety-isolation"] },
          "capability": { "type": "string", "minLength": 1 },
          "risk": { "type": "string", "enum": ["low", "medium", "high", "critical"] },
          "kind": { "type": "string", "enum": ["standard", "variation", "edge", "adversarial"] },
          "flaky": { "type": "boolean" },
          "reporting": {
            "type": "object",
            "properties": {
              "dangerousOperationProbe": { "type": "boolean" },
              "protectedPaths": {
                "type": "array",
                "items": { "type": "string", "minLength": 1, "pattern": "^(?!/)(?![A-Za-z]:)(?!.*(?:^|/)\\.\\.?(?:/|$))(?!.*\\\\)(?!.*//).+$" },
                "uniqueItems": true
              },
              "toolMetricMode": { "type": "string", "enum": ["execute", "refuse", "exclude"] },
              "linearIssueReadLimit": { "type": "integer", "minimum": 0, "maximum": 1000 },
              "workflowDemand": {
                "type": "object",
                "required": ["taskFamily", "expectedOwner"],
                "properties": {
                  "taskFamily": { "type": "string", "minLength": 1, "maxLength": 128, "pattern": "^[a-z][a-z0-9]*(?:[._/-][a-z0-9]+)*$" },
                  "expectedOwner": {
                    "type": "object",
                    "required": ["kind", "id"],
                    "properties": {
                      "kind": { "type": "string", "enum": ["rule", "skill", "builtin", "none"] },
                      "id": { "type": "string", "minLength": 1, "maxLength": 128, "pattern": "^[a-z][a-z0-9]*(?:[._/-][a-z0-9]+)*$" }
                    },
                    "additionalProperties": false
                  }
                },
                "additionalProperties": false
              },
              "knowledgeCoverage": {
                "type": "object",
                "required": ["requestRoot", "candidateOwners", "inventoryComplete", "stopBoundary"],
                "properties": {
                  "requestRoot": { "type": "string", "minLength": 1, "maxLength": 128, "pattern": "^[a-z][a-z0-9]*(?:[._/-][a-z0-9]+)*$" },
                  "candidateOwners": {
                    "type": "array",
                    "minItems": 1,
                    "items": {
                      "type": "object",
                      "required": ["kind", "id"],
                      "properties": {
                        "kind": { "type": "string", "enum": ["rule", "skill"] },
                        "id": { "type": "string", "minLength": 1, "maxLength": 128, "pattern": "^[a-z][a-z0-9]*(?:[._/-][a-z0-9]+)*$" }
                      },
                      "additionalProperties": false
                    }
                  },
                  "inventoryComplete": { "type": "boolean" },
                  "stopBoundary": { "type": "string", "enum": ["execution-end", "handoff", "validated-handoff", "blocked"] }
                },
                "additionalProperties": false
              },
              "expected": {
                "type": "object",
                "additionalProperties": false,
                "properties": {
                  "rules": { "type": "array", "items": { "type": "string", "minLength": 1 }, "uniqueItems": true },
                  "skills": { "type": "array", "items": { "type": "string", "minLength": 1 }, "uniqueItems": true }
                }
              }
            },
            "additionalProperties": false
          },
          "input": {
            "type": "object",
            "required": ["scenario"],
            "anyOf": [
              { "type": "object", "required": ["replay"] },
              { "type": "object", "required": ["behavioral"] }
            ],
            "properties": {
              "scenario": { "type": "string", "minLength": 1 },
              "fixture": {
                "type": "object",
                "required": ["files"],
                "properties": {
                  "files": {
                    "type": "array",
                    "items": {
                      "type": "object",
                      "required": ["path", "content"],
                      "properties": {
                        "path": { "type": "string", "minLength": 1 },
                        "content": { "type": "string" }
                      },
                      "additionalProperties": false
                    }
                  },
                  "allowedWritePaths": {
                    "type": "array",
                    "items": {
                      "type": "string",
                      "minLength": 1,
                      "pattern": "^(?!/)(?![A-Za-z]:)(?!.*(?:^|/)\\.\\.?(?:/|$))(?!.*\\\\)(?!.*//).+$"
                    },
                    "uniqueItems": true
                  },
                  "tests": {
                    "type": "array",
                    "items": {
                      "type": "object",
                      "required": ["command", "expectedExitCode"],
                      "properties": {
                        "command": { "type": "array", "items": { "type": "string", "minLength": 1 }, "minItems": 1 },
                        "expectedExitCode": { "type": "integer", "minimum": 0 },
                        "kind": { "type": "string", "enum": ["behavior", "api-contract"] },
                        "diagnosticCategory": { "type": "string", "enum": ["behavior", "api-contract", "api-existence"] },
                        "timeoutMs": { "type": "integer", "minimum": 1000, "maximum": 120000 }
                      },
                      "additionalProperties": false
                    }
                  },
                  "git": {
                    "type": "object",
                    "required": ["init"],
                    "properties": {
                      "init": { "type": "boolean" },
                      "commitMessage": { "type": "string", "minLength": 1, "maxLength": 128 }
                    },
                    "additionalProperties": false
                  }
                },
                "additionalProperties": false
              },
              "compaction": {
                "type": "object",
                "required": ["resumePrompt", "contextWindow", "autoCompactTokenLimit"],
                "properties": {
                  "resumePrompt": { "type": "string", "minLength": 1 },
                  "contextWindow": { "type": "integer", "minimum": 1000 },
                  "autoCompactTokenLimit": { "type": "integer", "minimum": 1000 },
                  "activeObjective": { "type": "string", "minLength": 1, "maxLength": 1024 },
                  "terminalCondition": { "type": "string", "minLength": 1, "maxLength": 512 },
                  "completedFacts": { "type": "array", "items": { "type": "string", "minLength": 1 }, "uniqueItems": true },
                  "noRepeatSet": { "type": "array", "items": { "type": "string", "minLength": 1 }, "uniqueItems": true },
                  "nextAction": { "type": "string", "minLength": 1, "maxLength": 512 }
                },
                "additionalProperties": false
              },
              "replay": {
                "type": "object",
                "required": ["events", "output", "artifacts", "exitCode"],
                "properties": {
                  "events": { "type": "array", "items": { "type": "string", "minLength": 1 }, "uniqueItems": true },
                  "output": { "type": "string" },
                  "artifacts": { "type": "array", "items": { "type": "string", "minLength": 1 }, "uniqueItems": true },
                  "exitCode": { "type": "integer", "minimum": 0 }
                },
                "additionalProperties": false
              },
              "behavioral": {
                "type": "object",
                "required": ["engine"],
                "anyOf": [
                  {
                    "type": "object",
                    "properties": { "engine": { "const": "hook" } },
                    "required": ["toolName", "toolInput", "writeTargets"]
                  },
                  {
                    "type": "object",
                    "properties": { "engine": { "const": "focused-verification" } },
                    "required": ["commands"]
                  }
                ],
                "properties": {
                  "engine": { "type": "string", "enum": ["hook", "focused-verification"] },
                  "host": { "type": "string", "enum": ["codex", "cursor", "qoder", "zcode", "antigravity", "claude"] },
                  "event": { "type": "string", "enum": ["PreToolUse", "PermissionRequest"] },
                  "toolName": { "type": "string", "minLength": 1 },
                  "toolInput": { "type": "object" },
                  "writeTargets": {
                    "type": "array",
                    "items": {
                      "type": "string",
                      "minLength": 1,
                      "pattern": "^(?!/)(?![A-Za-z]:)(?!.*(?:^|/)\\.\\.?(?:/|$))(?!.*\\\\)(?!.*//).+$"
                    },
                    "uniqueItems": true
                  },
                  "environment": {
                    "type": "object",
                    "additionalProperties": { "type": "string" }
                  },
                  "config": { "type": "object" },
                  "commands": {
                    "type": "array",
                    "minItems": 1,
                    "items": {
                      "type": "object",
                      "required": ["name", "command"],
                      "properties": {
                        "name": { "type": "string", "minLength": 1 },
                        "command": { "type": "string", "minLength": 1 },
                        "status": { "type": "string", "minLength": 1 }
                      },
                      "additionalProperties": false
                    }
                  }
                },
                "additionalProperties": false
              }
            },
            "additionalProperties": false
          },
          "oracle": {
            "type": "object",
            "required": ["requiredEvents", "forbiddenEvents", "requiredOutputFragments", "forbiddenOutputFragments", "requiredArtifacts", "forbiddenArtifacts", "exitCode"],
            "properties": {
              "requiredEvents": { "type": "array", "items": { "type": "object", "required": ["value", "dimension", "critical"], "properties": { "value": { "type": "string", "minLength": 1 }, "dimension": { "type": "string", "enum": ["correctness", "safety", "evidenceQuality", "efficiency"] }, "critical": { "type": "boolean" } }, "additionalProperties": false } },
              "forbiddenEvents": { "type": "array", "items": { "type": "object", "required": ["value", "dimension", "critical"], "properties": { "value": { "type": "string", "minLength": 1 }, "dimension": { "type": "string", "enum": ["correctness", "safety", "evidenceQuality", "efficiency"] }, "critical": { "type": "boolean" } }, "additionalProperties": false } },
              "requiredOutputFragments": { "type": "array", "items": { "type": "object", "required": ["value", "dimension", "critical"], "properties": { "value": { "type": "string", "minLength": 1 }, "dimension": { "type": "string", "enum": ["correctness", "safety", "evidenceQuality", "efficiency"] }, "critical": { "type": "boolean" } }, "additionalProperties": false } },
              "forbiddenOutputFragments": { "type": "array", "items": { "type": "object", "required": ["value", "dimension", "critical"], "properties": { "value": { "type": "string", "minLength": 1 }, "dimension": { "type": "string", "enum": ["correctness", "safety", "evidenceQuality", "efficiency"] }, "critical": { "type": "boolean" } }, "additionalProperties": false } },
              "exactOutput": { "type": "object", "required": ["value", "dimension", "critical"], "properties": { "value": { "type": "string", "minLength": 1 }, "dimension": { "type": "string", "enum": ["correctness", "safety", "evidenceQuality", "efficiency"] }, "critical": { "type": "boolean" } }, "additionalProperties": false },
              "requiredArtifacts": { "type": "array", "items": { "type": "object", "required": ["value", "dimension", "critical"], "properties": { "value": { "type": "string", "minLength": 1 }, "dimension": { "type": "string", "enum": ["correctness", "safety", "evidenceQuality", "efficiency"] }, "critical": { "type": "boolean" } }, "additionalProperties": false } },
              "forbiddenArtifacts": { "type": "array", "items": { "type": "object", "required": ["value", "dimension", "critical"], "properties": { "value": { "type": "string", "minLength": 1 }, "dimension": { "type": "string", "enum": ["correctness", "safety", "evidenceQuality", "efficiency"] }, "critical": { "type": "boolean" } }, "additionalProperties": false } },
              "exitCode": { "type": "object", "required": ["value", "dimension", "critical"], "properties": { "value": { "type": "integer", "minimum": 0 }, "dimension": { "type": "string", "enum": ["correctness", "safety", "evidenceQuality", "efficiency"] }, "critical": { "type": "boolean" } }, "additionalProperties": false },
              "llmRubrics": { "type": "array", "items": { "type": "object", "required": ["rubric", "dimension", "critical"], "properties": { "rubric": { "type": "string", "minLength": 1 }, "judgeModel": { "type": "string" }, "threshold": { "type": "number", "minimum": 0, "maximum": 1 }, "dimension": { "type": "string", "enum": ["correctness", "safety", "evidenceQuality", "efficiency"] }, "critical": { "type": "boolean" } }, "additionalProperties": false } }
            },
            "additionalProperties": false
          },
          "weights": {
            "type": "object",
            "required": ["correctness", "safety", "evidenceQuality", "efficiency"],
            "properties": {
              "correctness": { "type": "number", "minimum": 0, "maximum": 10 },
              "safety": { "type": "number", "minimum": 0, "maximum": 10 },
              "evidenceQuality": { "type": "number", "minimum": 0, "maximum": 10 },
              "efficiency": { "type": "number", "minimum": 0, "maximum": 10 }
            },
            "additionalProperties": false
          },
          "repetitions": { "type": "integer", "minimum": 1, "maximum": 3 }
        },
        "additionalProperties": false
      }
    }
  },
  "additionalProperties": false
}
